SUC DESTINO;SKU;# TRANSF;DESCRIPTION;FECHA;SHIP;SHIP.1
IÑAQUITO;69646;1513238;AROMA NATURAL OREGANO EN HOJA 30 GR.;31/3/2026;25;1,00
IÑAQUITO;205955020;1513238;COMBO SNACKS SUPERMIX ALMOHADA 392GR;31/3/2026;5;1,00
IÑAQUITO;207805009;1513238;TIPS AMBIENTAL SPRAY BRISAS DE LAVANDA 360 ML.;31/3/2026;12;1,00
IÑAQUITO;111287;1513238;COLGATE CREMA DENTAL SENSITIVE PRO-ALIVIO 75ML;31/3/2026;12;1,00
IÑAQUITO;186904904;1513238;SANTA MARIA DETERGENTE LÍQUIDO LAVANDA DOYPACK 1.8LT;31/3/2026;12;1,00
IÑAQUITO;27820;1513238;ORIENTAL TALLARIN FIDEO RAPIDITO CARNE 100 GR.;31/3/2026;24;1,00
IÑAQUITO;71143;1513238;DOVE DESODORANTE BARRA INVISIBLE CARE 45 GR.;31/3/2026;12;1,00
IÑAQUITO;190755294;1513238;PANTENE ACONDICIONADOR BAMBU 200 ML.;31/3/2026;12;1,00
IÑAQUITO;121200682;1513238;"DIAFANO PAPEL ENCERADO 75"" X 24U";31/3/2026;24;1,00
IÑAQUITO;109027;1513238;GLADE AMBIENTAL AEROSOL HAWAIAN BREZE 400 ML.;31/3/2026;12;1,00
IÑAQUITO;111850091;1513238;QUAKER AVENA EXTRA 1 KG.;31/3/2026;12;1,00
IÑAQUITO;111750120;1513238;LA LECHERA  PACK PROMOCIONAL LECHE UHT SEMIDESCREMADA 1 LT.;31/3/2026;20;5,00
IÑAQUITO;198154899;1513238;CICLON DETERGENTE LIQUIDO CON SUAVIZANTE 3LT.;31/3/2026;4;1,00
IÑAQUITO;97601;1513238;GUSTADINA PASTA DE TOMATE BALDE 4 KG.;31/3/2026;5;5,00
IÑAQUITO;108550098;1513238;NOSOTRAS TAMPON APLICADOR REGULAR 8UN;31/3/2026;10;1,00
IÑAQUITO;135403413;1513238;PARA MI BEBE RINSE MZ 200ML (12);31/3/2026;12;1,00
IÑAQUITO;183454928;1513238;GOLDERY FUNDAS CAMISETA EXTRA FUERTES PAQ X 75 UN.;31/3/2026;6;1,00
IÑAQUITO;61796;1513238;ESTRELLA VIRUTA PARA PISOS # 8 UN.;31/3/2026;50;1,00
IÑAQUITO;67294;1513238;COLOMBINA CARAMELO MENTA HELADA 400 GR.;31/3/2026;18;1,00
IÑAQUITO;67700;1513238;MASTER GUANTE BI-COLOR DOMESTICO C-22 #9;31/3/2026;12;1,00
IÑAQUITO;205404931;1513238;ISABELLA JABON INTIMO FEMENINO PROMOCIONAL X2 250ML C/U;31/3/2026;12;1,00
IÑAQUITO;29116;1513238;PRODELSOL DESTAPADOR DE CAÑERIAS MEDIANO X 12 UN.;31/3/2026;12;1,00
IÑAQUITO;131801326;1513238;DEJA POLVO SUAV BRISA C/BIC 1.2KG;31/3/2026;10;1,00
IÑAQUITO;76641;1513238;MAGGI CALDO DE COSTILLA 84 GR X 8 UN;31/3/2026;210;1,00
IÑAQUITO;29080;1513238;LAVA CREMA LAVAVAJILLA COLOR VERDE 450 GR.;31/3/2026;18;1,00
IÑAQUITO;132801811;1513238;GUSTADINA SALSA CIRUELA 200 GR;31/3/2026;12;1,00
IÑAQUITO;37693;1513238;LUSTRE PAÑO ESPONJA X 3 UN.;31/3/2026;20;1,00
IÑAQUITO;162603015;1513238;SUAVITEL DOYPACK FRESCA PRIMAVERA 1.5 LT.;31/3/2026;8;1,00
IÑAQUITO;207604995;1513238;LA VAQUITA LECHE EN POLVO ENTERA 400GR;31/3/2026;120;4,00
IÑAQUITO;69221;1513238;EXQUISITO CHIFLES DE SAL 60 GR.;31/3/2026;12;1,00
IÑAQUITO;140103204;1513238;CASERITO ARROZ ENVEJECIDO 4LB;31/3/2026;16;1,00
IÑAQUITO;199304975;1513238;LAVATODO LAVAVAJILLA LIMÓN DOYPACK 360 ML.;31/3/2026;12;1,00
IÑAQUITO;129951528;1513238;REXONA DESODORANTE MEN AER ANTIB 90G;31/3/2026;6;1,00
IÑAQUITO;154153000;1513238;REAL SARDINA 3PACK TOMATE 156GR C/U.;31/3/2026;30;1,00
IÑAQUITO;27821;1513238;ORIENTAL TALLARIN FIDEO RAPIDITO DE POLLO 100 GR.;31/3/2026;24;1,00
IÑAQUITO;137853135;1513238;NINACURO JABON HUMECTACION PROFUNDA X 360G;31/3/2026;12;1,00
IÑAQUITO;199655100;1513238;MENTOS CARAMELO MASTICABLE DE MENTA UND;31/3/2026;14;1,00
IÑAQUITO;186055228;1513238;VITA LECHE SEMIDESCREMADA TETRAFINO 900ML;31/3/2026;12;1,00
IÑAQUITO;33002;1513238;LOS ANDES SALSA DE TOMATE 4.2 KG.;31/3/2026;4;1,00
IÑAQUITO;104290;1513238;COFFEE-MATE CREMA PARA CAFE 435 GR.;31/3/2026;12;1,00
IÑAQUITO;42371;1513238;SURF DETERGENTE UN DIA EN EL PARQUE 1 KG.;31/3/2026;12;1,00
IÑAQUITO;131801246;1513238;DEJA POLVO FLORAL C/BICARBONATO 1.2KG;31/3/2026;10;1,00
IÑAQUITO;207256513;1513238;ELVIVE CREMA DE PEINAR DREAM LISO 300ML.;31/3/2026;6;1,00
IÑAQUITO;105136;1513238;STEVIA SWEET ENDULZANTE EN GOTAS FCO 30 ML;31/3/2026;6;1,00
IÑAQUITO;133101606;1513238;AROMATEL SUAVIZ FLORAL DOYPACK 900ML;31/3/2026;10;1,00
IÑAQUITO;34815;1513238;SCOTT TOALLA DE COCINA DURAMAX 2 EN 1;31/3/2026;12;1,00
IÑAQUITO;79499;1513238;CONDIMENSA ACHIOTE EN PASTA VASO 200 GR.;31/3/2026;24;1,00
IÑAQUITO;104250215;1513238;PANOLINI PAÑAL PREMIUM SEC G X 40;31/3/2026;6;1,00
IÑAQUITO;77499;1513238;SUAVITEL 2 SUAVIZANTES SOFLAN 1 LT PRECIO ESPECIAL;31/3/2026;12;2,00
IÑAQUITO;169003514;1513238;VAN CAMPS 6PACK ATUN GIRASOL 80GR;31/3/2026;16;2,00
IÑAQUITO;47467;1513238;AXION LAVAVAJILLA CREMA LIMON 850 GR;31/3/2026;12;1,00
IÑAQUITO;95621;1513238;CRIS PASTA DE MANI FUNDA 170 GR.;31/3/2026;12;1,00
IÑAQUITO;84571;1513308;SAN CARLOS AZUCAR BLANCA 100 STICKS 500 GR;31/3/2026;120;5,00
IÑAQUITO;207604995;1513308;LA VAQUITA LECHE EN POLVO ENTERA 400GR;31/3/2026;120;4,00
IÑAQUITO;27898;1513308;MC CORMICK SALSA INGLESA FRASCO 175 GR;31/3/2026;48;2,00
IÑAQUITO;27228;1513308;SABORA AJO FUNDA 500 GR.;31/3/2026;60;5,00
IÑAQUITO;62321;1513308;ELITE SERVILLETA COCTAIL 24 X 24CM X 300 UN.;31/3/2026;96;6,00
IÑAQUITO;209855157;1513387;ORASI BEBIDA DE ALMENDRA SABOR NATURAL 1LT;31/3/2026;36;3,00
IÑAQUITO;209855165;1513387;ORASI BEBIDA DE AVELLANA 1LT;31/3/2026;12;1,00
