SUC DESTINO;SKU;# TRANSF;DESCRIPTION;FECHA;SHIP;SHIP.1
IÑAQUITO;180057062;1513238;SANTA MARIA PAPEL HIGIENICO 16MT 2H X12UN;31/3/2026;4;1,00
IÑAQUITO;61332;1513238;MARCELLO´S PASTA DE TOMATE 1.82 KG.;31/3/2026;6;1,00
IÑAQUITO;109100110;1513238;REXONA AEROSOL BIPACK BAMBOO 90G;31/3/2026;6;1,00
IÑAQUITO;117751431;1513238;PACIFICO SAL DE MESA 2 KG;31/3/2026;25;1,00
IÑAQUITO;42175;1513238;PANCHITO FIESTA NATURAL 163 GR.;31/3/2026;12;1,00
IÑAQUITO;27935;1513238;MAGGI CREMA DE CHOCLO 64 GR.;31/3/2026;72;2,00
IÑAQUITO;31061;1513238;CHERRY BETUN LIQUIDO BLANCO 60 ML.;31/3/2026;12;1,00
IÑAQUITO;27898;1513238;MC CORMICK SALSA INGLESA FRASCO 175 GR;31/3/2026;24;1,00
IÑAQUITO;28805;1513238;LA BRUJITA CEPILLO DE ROPA CAPRI UN.;31/3/2026;12;1,00
IÑAQUITO;183955052;1513238;APIKAI MANI CON CEBOLLA 300G;31/3/2026;10;1,00
IÑAQUITO;206505151;1513238;ROSES AGUA MICELAR 200ML;31/3/2026;12;1,00
IÑAQUITO;199304959;1513238;LAVATODO LAVAVAJILLA CREMA SANDIA 450 GR.;31/3/2026;24;1,00
IÑAQUITO;201004905;1513238;VILEDA PAÑO PARA PISO ULTRA FRESH UN.;31/3/2026;24;1,00
IÑAQUITO;132852432;1513238;SUAVITEL DOYPACK FRESCA PRIMAVERA 800 ML;31/3/2026;12;1,00
IÑAQUITO;83197;1513238;DOVE DESODORANTE MEN ROLLON EXTRA FRESH 50 ML.;31/3/2026;12;1,00
IÑAQUITO;35241;1513238;ESTRELLA GUANTE BICOLOR 7 1/2;31/3/2026;12;1,00
IÑAQUITO;27960;1513238;SNOB MERMELADA FRUTI-MORA 600 GR.;31/3/2026;12;1,00
IÑAQUITO;71417;1513238;PRODELSOL CEPILLO SANITARIO CON BASE X 12 UN.;31/3/2026;12;1,00
IÑAQUITO;208654935;1513238;AXE DESODORANTE BOBYSPRAY FRAGANCIA CHERRY SPRITZ 150 ML.;31/3/2026;12;1,00
IÑAQUITO;102951;1513238;ELITE PAPEL HIGIENICO SOFT&STRONG MEGA 32 M X 12 UNI;31/3/2026;4;1,00
IÑAQUITO;162853073;1513238;SANTA MARIA ARROZ ENVEJECIDO 22.68 KG.;31/3/2026;1;1,00
IÑAQUITO;101850119;1513238;VIRGINIA LUSTRAMUEBLES CREMA VAINILLA 250 ML.;31/3/2026;12;1,00
IÑAQUITO;203704948;1513238;MAX WASH DETERGENTE EN POLVO AROMA LIMÓN 1 KG;31/3/2026;20;1,00
IÑAQUITO;114150200;1513238;DON VITTORIO FETTUCINI  400 GR.;31/3/2026;20;1,00
IÑAQUITO;124701600;1513238;SYLVANIA TOLEDO LED A60 9W 6.5K MV BLX2;31/3/2026;10;1,00
IÑAQUITO;137802979;1513238;COLGATE CREMA DENTAL LUMINOUS WHITE CARBON 75ML;31/3/2026;48;1,00
IÑAQUITO;33009;1513238;LOS ANDES SALSA DE TOMATE ECOPACK 400 GR;31/3/2026;12;1,00
IÑAQUITO;149652998;1513238;LAVATODO DETERGENTE MULTIUSOS FLORAL 1KG.;31/3/2026;12;1,00
IÑAQUITO;166453317;1513238;GLADE MINI GEL MORA RADIANTE 70G;31/3/2026;12;1,00
IÑAQUITO;118201861;1513238;COLGATE CEPILLO DENTAL PRO CUIDADO  X 4PK;31/3/2026;12;1,00
IÑAQUITO;120001964;1513238;BANCHIS CHIFLE SABOR NATURAL DE 40GR.;31/3/2026;60;1,00
IÑAQUITO;42989;1513238;CONDIMENSA AJO EN PASTA BOTELLA PET. 470 GR;31/3/2026;45;3,00
IÑAQUITO;177404844;1513238;TIPS AMBIENTADOR TIPO CONO GEL FRUT ROJOS 170 GR;31/3/2026;12;1,00
IÑAQUITO;77294;1513238;CLOROX CLORO LIMON 500 ML.;31/3/2026;24;1,00
IÑAQUITO;166203115;1513238;ELVIVE ACONDICIONADOR COLOR VIVE 370ML.;31/3/2026;12;1,00
IÑAQUITO;197754972;1513238;GOLPE SNACKS SABOR RANCHERO 55GR;31/3/2026;36;1,00
IÑAQUITO;186655063;1513238;TIPS PASTILLA AMBIENTE BRISAS DE LAVANDA 60 GR.;31/3/2026;24;1,00
IÑAQUITO;82132;1513238;NOSOTRAS PROTECTORES DIARIOS LARGOS X 50 UN.;31/3/2026;12;1,00
IÑAQUITO;27873;1513238;MAGGI MOSTAZA 4 KG.;31/3/2026;2;2,00
IÑAQUITO;30750;1513238;INDIO BRAVO SALSA DE AJI 100 GR.;31/3/2026;24;1,00
IÑAQUITO;87529;1513238;CICLON DETERGENTE POLVO ULTRA FLORAL 3 KG.;31/3/2026;4;1,00
IÑAQUITO;175554902;1513238;NOSOTRAS TOALLAS HIGIENICAS NATURAL PLUS CANALGEL 10 UND;31/3/2026;24;1,00
IÑAQUITO;185905024;1513238;NESTLE COCO CLASSIC COOKIES 450GR.;31/3/2026;20;1,00
IÑAQUITO;199304983;1513238;LAVATODO LAVAVAJILLA SANDIA DOYPACK 360 ML.;31/3/2026;12;1,00
IÑAQUITO;170053156;1513238;MASTER GUANTES LIMPIEZA PROFUNDA NEGRO/VERDE #7.5;31/3/2026;12;1,00
IÑAQUITO;93770;1513238;LA DURA FUNDA DE BASURA GRANDE VERDE 30X35 X 10 UN.;31/3/2026;10;1,00
IÑAQUITO;28988;1513238;KALIPTO DESINFECTANTE EUCALIPTO 4 LT.;31/3/2026;24;6,00
IÑAQUITO;29013;1513238;SAPOLIO INSECTICIDA MATA CUCARACHAS 360 ML.;31/3/2026;12;1,00
IÑAQUITO;27210;1513238;SUPERFINO VINAGRE NATURAL 500 GR.;31/3/2026;24;1,00
IÑAQUITO;207805017;1513238;TIPS AMBIENTAL SPRAY EXPLOSION FLORAL 360 ML.;31/3/2026;12;1,00
IÑAQUITO;47520;1513238;MAGGI MAYONESA SOBRE 90 GR.;31/3/2026;96;1,00
IÑAQUITO;149652980;1513238;LAVATODO DETERGENTE MULTIUSOS LIMON 1KG;31/3/2026;12;1,00
IÑAQUITO;108650195;1513238;PRUDENTIAL CONFORT PAÑAL GRANDE X 20;31/3/2026;4;1,00
IÑAQUITO;182805626;1513238;PALMA DE ORO ACEITE POPULAR FUNDA 480ML.;31/3/2026;15;1,00
IÑAQUITO;111700085;1513238;NÍVEA DESODORANTE BLACK AND WHITE PACK 2DO 50%;31/3/2026;6;1,00
IÑAQUITO;206455035;1513238;NUTRIBELA TRATAMIENTO BIOCOLAGENO POTE 450ML;31/3/2026;18;1,00
IÑAQUITO;27315;1513238;SABORA PIMIENTA FUNDA 250 GR.;31/3/2026;24;1,00
IÑAQUITO;62688;1513238;PATO ADHESIVO INODORO FLORAL LAVANDA 30 GR.;31/3/2026;24;1,00
IÑAQUITO;39510;1513238;SNOB MERMELADA SACHET SABOR A FRUTIMORA 240 GR;31/3/2026;48;2,00
IÑAQUITO;39881;1513238;GOLDERIE TRADING MOLDE RECTANGULAR CON TAPA X 10 UN.;31/3/2026;20;1,00
IÑAQUITO;211004992;1513238;INALECSA PANCHITOS NATURAL 63 G;31/3/2026;30;1,00
IÑAQUITO;197254898;1513238;CLEANFUL PAÑO ABSORBENTE PACK X 10 UN.;31/3/2026;24;1,00
IÑAQUITO;28872;1513238;MASTER GUANTE AZUL C-20# 8 UN.;31/3/2026;24;2,00
IÑAQUITO;60914;1513238;BLENDY ENJUAGUE BUCAL NIÑOS TITUFRUTI  300 ML;31/3/2026;12;1,00
IÑAQUITO;178954813;1513238;COLGATE CEPILLO DENTAL SLIM SOFT CHARCOAL 2X1;31/3/2026;12;1,00
IÑAQUITO;199304932;1513238;LAVATODO LAVAVAJILLA CREMA LIMÓN 450 GR.;31/3/2026;24;1,00
IÑAQUITO;168953155;1513238;LADY SPEED STICK DESODORANTE CLINICAL CREMA 70G;31/3/2026;18;1,00
IÑAQUITO;182105099;1513238;EL SABOR LAUREL 12 GR;31/3/2026;24;1,00
IÑAQUITO;160803013;1513238;AMAZONAS FLOR DE JAMAICA 60GR.;31/3/2026;30;1,00
IÑAQUITO;185155067;1513238;TUMIX CHICLES SABOR SANDIA X30;31/3/2026;24;0,50
IÑAQUITO;27208;1513238;DOÑA PETRA VINAGRE BLANCO 3.5 LT.;31/3/2026;24;6,00
IÑAQUITO;35159;1513238;GUSTADINA MERMELADA SACHET SABOR A GUAYABA 250 GR.;31/3/2026;12;1,00
IÑAQUITO;79412;1513238;TIPS PASTILLA BAÑO ANTIBACTERIAL MANZANA & CANELA 90 GR.;31/3/2026;24;1,00
IÑAQUITO;33102;1513238;QUAKER AVENA EXTRA 500 GR.;31/3/2026;25;1,00
IÑAQUITO;69647;1513238;AROMA NATURAL CANELA EN RAMA 30 GR.;31/3/2026;60;2,00
IÑAQUITO;147302960;1513238;PERLA DETERGENTE LIQUIDO PARA BEBE 900 ML.;31/3/2026;12;1,00
IÑAQUITO;170053244;1513238;MASTER GUANTES LIMPIEZA PROFUNDA NEGRO/VERDE #8;31/3/2026;12;1,00
IÑAQUITO;28577;1513238;FAMILIA SERVILLETA DECORADA X 100 UN.;31/3/2026;36;1,00
IÑAQUITO;97676;1513238;CONDIMENSA ACHIOTE EN GRANO 50 GR.;31/3/2026;25;1,00
IÑAQUITO;170053252;1513238;MASTER GUANTES LIMPIEZA PROFUNDA NEGRO/VERDE #8.5;31/3/2026;12;1,00
IÑAQUITO;178254868;1513238;LAVA LIQUIDO LAVAVAJILLA LIMON DOYPACK 450 ML;31/3/2026;12;1,00
IÑAQUITO;196805029;1513238;BEE COLOR TINTE EN POLVO 7 RUBIO MEDIO 6 GR;31/3/2026;6;1,00
IÑAQUITO;163453813;1513238;ESTRELLA GUANTE DOMESTICO AMARILLO TALLA 8 UN.;31/3/2026;24;2,00
IÑAQUITO;134501661;1513238;AXION LAVAVAJILLA CREMA LIMON 850 GR X2 PRECIO ESPECIAL;31/3/2026;6;1,00
IÑAQUITO;27179;1513238;SNOB ACEITE DE OLIVA BOTELLA 150 ML;31/3/2026;24;1,00
IÑAQUITO;79413;1513238;TIPS PASTILLA BAÑO ANTIBACTERIAL LAVANDA 90 GR.;31/3/2026;24;1,00
IÑAQUITO;67378;1513238;CONDIMENSA CANELA  EN RAMA 60 GR.;31/3/2026;50;2,00
IÑAQUITO;42691;1513238;PERLA JABON BEBE 200 GR.;31/3/2026;48;1,00
IÑAQUITO;185854941;1513238;DORITOS FLAMIN HOT SABOR PICANTE Y QUESO 140GR;31/3/2026;18;1,00
IÑAQUITO;100057;1513238;CONDIMENSA AJO EN PASTA DOYPACK VALV 200 GR;31/3/2026;25;1,00
IÑAQUITO;115850988;1513238;KALIPTO DESINFECTANTE ORIGINAL EUCALIPTO 1 LT.;31/3/2026;12;1,00
IÑAQUITO;132251901;1513238;BANQUETE ARROZ ENVEJECIDO ARROBA 11.36K;31/3/2026;5;5,00
IÑAQUITO;183104979;1513238;SANTA MARIA CREMA LAVAVAJILLA MANZANA 500GR;31/3/2026;24;1,00
IÑAQUITO;118500692;1513238;EL MAQUEÑITO MIX DE PAPAS CHIFLES YUCA CHICHARON DE 120GR;31/3/2026;25;1,00
IÑAQUITO;112050117;1513238;WEIR ENJUAGUE BUCAL ANTI SARRO 250ML;31/3/2026;12;1,00
IÑAQUITO;118500705;1513238;DOVE SHAMPOO RESTAURACIÓN ANIMOACIDO 370ML+ACONDICIONADOR 370ML;31/3/2026;6;1,00
IÑAQUITO;27253;1513238;SABORA COMINO FUNDA 50 GR.;31/3/2026;12;0,08
IÑAQUITO;93771;1513238;LA DURA FUNDA DE BASURA GRANDE NEGRA 30X35 X 10UN.;31/3/2026;10;1,00
IÑAQUITO;184205202;1513238;SUAVITEL SUAVIZANTE FRESCURA DE MANZANA 2.3 LT.;31/3/2026;6;1,00
IÑAQUITO;172205846;1513238;RUFFLES PAPAS SABOR CREMA Y CEBOLLA 136G;31/3/2026;21;1,00
IÑAQUITO;57054;1513238;GUSTADINA PICA RICO SALSA DE AJI 200 ML.;31/3/2026;24;1,00
IÑAQUITO;99556;1513238;ORANGINE BEBIDA GASEOSA SABOR A MANZANA 3.785 LT.;31/3/2026;4;1,00
IÑAQUITO;197755078;1513238;LIMPOL LAVAVAJILLA LIMON DOY PACK 1LT;31/3/2026;12;1,00
IÑAQUITO;207355116;1513238;INKA CHIPS PAPAS SABOR JALAPEÑO 115GR;31/3/2026;12;1,00
IÑAQUITO;104340;1513238;CONDIMENSA CILANTRO 25 GR.;31/3/2026;25;1,00
IÑAQUITO;43604;1513238;MANI CRIS MANI SALADITO 100 GR.;31/3/2026;12;1,00
IÑAQUITO;174854356;1513238;TIPS BAMBÚ DIFUSOR ESENCIA ROSE GOLD 20 ML;31/3/2026;15;1,00
IÑAQUITO;200154928;1513238;COLGATE CEPILLO DENTAL TOTAL ESPUMOSO SUAVE X2;31/3/2026;24;2,00
IÑAQUITO;205205245;1513238;CIELO AGUA SIN GAS 400ML;31/3/2026;24;1,00
IÑAQUITO;193807820;1513238;VOLT BEBIDA ENERGIZANTES PINK 400 ML;31/3/2026;6;1,00
IÑAQUITO;144903081;1513238;COLGATE CREMA DENTAL NATURALS CARBON 90 GR.;31/3/2026;12;0,25
IÑAQUITO;166203035;1513238;DEJA DETERGENTE LIQUIDO DILUIR FLORAL 500ML;31/3/2026;6;1,00
IÑAQUITO;177904890;1513238;VANISH QUITA MANCHAS GOLD BLANCO DOYPACK 120 GR;31/3/2026;24;1,00
IÑAQUITO;83213;1513238;NOSOTRAS PROTECTORES DIARIOS X 15 UN.;31/3/2026;36;1,00
IÑAQUITO;43372;1513238;SPEED STICK DESODORANTE ROLL-ON 24/7 AP COOL NIGHT 50;31/3/2026;12;1,00
IÑAQUITO;28966;1513238;POLWAX CERA PLUS ROJA 1 LT.;31/3/2026;12;1,00
IÑAQUITO;124701626;1513238;SYLVANIA TOLEDO LED A60 9W 6500K BLX4;31/3/2026;10;1,00
IÑAQUITO;180057003;1513238;PAÑALIN TOALLAS HÚMEDAS MANZANILLA Y GLICERINA FLOW PACK X5O;31/3/2026;24;2,00
IÑAQUITO;28758;1513238;GATO NEGRO VINO CABERNET SAUVIGNON 750 ML.;31/3/2026;12;1,00
IÑAQUITO;28056;1513238;COLGATE CREMA DENTAL TRIPLE ACCION 75 ML.;31/3/2026;72;1,00
IÑAQUITO;31165;1513238;LA ESPAÑOLA ACEITE DE OLIVA EXTRA VIRGEN BOTELLA 250 ML;31/3/2026;12;1,00
IÑAQUITO;132801993;1513238;ETINCELLE COLORACIÓN 3 CASTAÑO OSCURO 2 TUB X 50G;31/3/2026;6;1,00
IÑAQUITO;28889;1513238;PRODELSOL TRAPEADOR INDUSTRIAL DE 40CM X 12 UN.;31/3/2026;12;1,00
IÑAQUITO;164502963;1513238;MICROLIMPIA RESTREGONA PARA PISO UN.;31/3/2026;6;1,00
IÑAQUITO;160003032;1513238;EL MACHO BARRA DETERGENTE AZUL  480 Gr;31/3/2026;24;1,00
IÑAQUITO;109445;1513238;VANISH QUITA MANCHAS BLANCO DOY PACK SIN CLORO 450 ML.;31/3/2026;24;1,00
IÑAQUITO;28972;1513238;ESTRELLA CERA AMARILLA COJIN 720 ML.;31/3/2026;24;1,00
IÑAQUITO;29418;1513238;CONDIMENSA ALIÑO PREPARADO FUNDA 200 GR.;31/3/2026;25;1,00
IÑAQUITO;154403030;1513238;PACA FIDEO CODO 400GR;31/3/2026;24;1,00
IÑAQUITO;181355310;1513238;CREMA DERM TOALLITAS HUMEDAS TRI-FLOWPACK;31/3/2026;6;1,00
IÑAQUITO;182555006;1513238;KALIPTO DESINFECTANTE LAVANDA FLORAL 3.8L;31/3/2026;8;2,00
IÑAQUITO;171152990;1513238;AXION LAVAVAJILLAS LIQUIDO 1.5 LT;31/3/2026;8;1,00
IÑAQUITO;77549;1513238;COLGATE CREMA DENTAL TRIPLE ACCION 50 ML.;31/3/2026;12;0,08
IÑAQUITO;193305045;1513238;SELLO AZUL DESTAPA CAÑERÍAS 425 GR.;31/3/2026;16;1,00
IÑAQUITO;30507;1513238;ISABEL ATUN EN ACEITE 900 GR;31/3/2026;12;1,00
IÑAQUITO;115850890;1513238;ILE CURCUMA EN POLVO 50G.;31/3/2026;12;0,08
IÑAQUITO;71029;1513238;ESTRELLA ESPONJA MIXTA DUO;31/3/2026;30;1,00
IÑAQUITO;162552967;1513238;CICLON DETERGENTE CON SUAVIZANTE 2KG.;31/3/2026;6;1,00
IÑAQUITO;201405320;1513238;SECRET DESODORANTE GEL INVISIBLE PWD PROT COTTON 73G;31/3/2026;12;1,00
IÑAQUITO;97715;1513238;CONDIMENSA LINASA DE 100 GR.;31/3/2026;25;1,00
IÑAQUITO;50099;1513238;ACT II CANGUIL SABOR MATEQUILLA EXTRA 80 GR.;31/3/2026;16;1,00
IÑAQUITO;102952;1513238;ELITE PAPEL HIGIENICO SOFT&STRONG PREMUM GRANDE 20M X12/4;31/3/2026;12;3,00
IÑAQUITO;27901;1513238;BANCHIS CHIFLES FAMILIAR NATURAL 150 GR.;31/3/2026;24;1,00
IÑAQUITO;77501;1513238;SCOTT TOALLA DE COCINA DURAMAX 2 EN 1 UN.;31/3/2026;12;1,00
IÑAQUITO;142903133;1513238;LIDEX  ALCOHOL ANTISEPTICO AL 70%-  (3785 ML) GALON;31/3/2026;6;1,00
IÑAQUITO;53744;1513238;AJAX DESINFECTANTE BICARBON NARANJA LIMON 2 LT;31/3/2026;6;1,00
IÑAQUITO;96124;1513238;NOSOTRAS TOALLAS BUENAS NOCHES INVISIBLE X10 UN.;31/3/2026;12;1,00
IÑAQUITO;101529;1513238;CLICK MULTICOLORES PLASTIFICACLIK 3 UN.;31/3/2026;72;1,00
IÑAQUITO;70805;1513238;LAVA CREMA LAVAVAJILLA AVENA 450 GR.;31/3/2026;18;1,00
IÑAQUITO;150953018;1513238;CICLON EXTRA POWER FLORAL 2 KG;31/3/2026;12;2,00
IÑAQUITO;152102962;1513238;HERBAL ESSENCES SHAMPOO BIO RENEW CHAMOMILE 400 ML;31/3/2026;6;1,00
IÑAQUITO;31187;1513238;CRIS-SAL SAL DE MESA 2 KG.;31/3/2026;50;2,00
IÑAQUITO;34725;1513238;LOS ANDES PURÉ DE TOMATE DOYPACK 100 GR;31/3/2026;48;1,00
IÑAQUITO;178404811;1513238;SUAVITEL PACK PRIMAVERA 2.8LT+GRATIS 1 LT.;31/3/2026;8;2,00
IÑAQUITO;151154031;1513238;SUAVIZANTE PERLA COCO Y AGUA DE ROSAS DOYPACK 1300 ML;31/3/2026;10;1,00
IÑAQUITO;201304916;1513238;IMPERIAL AGUA MINERAL LIMON 330ML;31/3/2026;12;1,00
IÑAQUITO;133751271;1513238;FABULOSO DESINFECTANTE LAVANDA 3 LT;31/3/2026;8;2,00
IÑAQUITO;169302995;1513238;LAVA CREMA LAVAVAJILLA AVENA 900 G;31/3/2026;12;1,00
IÑAQUITO;73353;1513238;TIPS MULTIUSOS BAÑO C/CLORO 500ML.;31/3/2026;12;1,00
IÑAQUITO;183955010;1513238;APIKAI MAIZ CON CEBOLLA 250G;31/3/2026;10;1,00
IÑAQUITO;182804931;1513238;NAPPIS PAÑALES  TOTAL SEC XXG X 64 UN;31/3/2026;4;1,00
IÑAQUITO;73349;1513238;TIPS LIMPIA VIDRIOS VINAGRE PISTOLA 500 ML.;31/3/2026;12;1,00
IÑAQUITO;44469;1513238;LIRA ALCOHOL GENERICO 1 LT.;31/3/2026;12;1,00
IÑAQUITO;33068;1513238;SANTA LUCIA HARINA SIN POLVO DE HORNEAR 1 KG;31/3/2026;15;1,00
IÑAQUITO;152602983;1513238;NOSOTRAS JABON INTIMO VINAGRE MANZANA 200 ML;31/3/2026;10;1,00
IÑAQUITO;180005895;1513238;CLORO BLANQUEADOR ORIGINAL CLOROX 160GR;31/3/2026;90;1,00
IÑAQUITO;152053785;1513238;PACK X 2 ESTRELLA ESPONJA MIXTA 2X1;31/3/2026;25;0,25
IÑAQUITO;104400084;1513238;EL SABOR PASTA DE TOMATE DOY PACK 150 GR;31/3/2026;24;1,00
IÑAQUITO;33222;1513238;CHOCO BREAK CHOCOLATE RELLENO LIQUIDO;31/3/2026;18;1,00
IÑAQUITO;131801300;1513238;DEJA POLVO LIMON C/BICARBONATO 1.2KG;31/3/2026;10;1,00
IÑAQUITO;100247;1513238;RICO TALCO DESODORANTE COOLMINT SPRAY 200 ML.;31/3/2026;12;1,00
IÑAQUITO;207354973;1513238;CICLON DETERGENTE LIQUIDO DOYPACK ELIMINA OLORES 1.8 LT;31/3/2026;10;1,00
IÑAQUITO;34817;1513238;VAN CAMPS ATUN 3PACK EN ACEITE 80GR C/U.;31/3/2026;32;2,00
IÑAQUITO;207404934;1513238;AXION LAVAVAJILLA CREMA BICARBONATO BLUE 450 GR;31/3/2026;24;1,00
IÑAQUITO;59947;1513238;REXONA DESODORANTE BARRA CLINICAL MEN 58 GR.;31/3/2026;12;1,00
IÑAQUITO;132901741;1513238;ISABELLA RINSE CON ACEITE DE ARGAN DOY PACK;31/3/2026;12;1,00
IÑAQUITO;97669;1513238;CONDIMENSA COMINO MOLIDO FUNDA 100 GR.;31/3/2026;25;1,00
IÑAQUITO;104501;1513238;AXION LAVAVAJILLA LIQUIDO LIMON 750 ML;31/3/2026;24;2,00
IÑAQUITO;111900263;1513238;DANEC MARGARINA INDUSTRIAL VEGETAL 1 LIBRA;31/3/2026;80;4,00
IÑAQUITO;90576;1513238;OLE SALSA TERIYAKI 300 GR.;31/3/2026;12;1,00
IÑAQUITO;204154925;1513238;CHEETOS BOCADITOS DE MAIZ MEGA QUESO 42GR;31/3/2026;28;1,00
IÑAQUITO;31063;1513238;CHERRY BETUN LIQUIDO NEGRO 60 ML.;31/3/2026;12;1,00
IÑAQUITO;60679;1513238;PARA MI BEBE TALCO MANZANILLA 100 GR.;31/3/2026;12;1,00
IÑAQUITO;102949;1513238;ELITE PAPEL HIGIENICO SOFT&STRONG MEGA 32 M X 4 UNI;31/3/2026;20;2,00
IÑAQUITO;181954929;1513238;PODEROX QUITAMANCHAS LÍQUIDO 500ML.;31/3/2026;24;1,00
IÑAQUITO;135503174;1513238;CONDIMENSA VINAGRE DE MANZANA 1 LT;31/3/2026;12;1,00
IÑAQUITO;120401247;1513238;BIG GASEOSA SABOR A MANZANA PET 300 ML;31/3/2026;24;1,00
IÑAQUITO;50182;1513238;MEDALLA DE ORO HARINA 9 KG.;31/3/2026;3;3,00
IÑAQUITO;46375;1513238;CARICIA BROCHETAS FESTIVAL 15CM X 100 UN.;31/3/2026;25;1,00
IÑAQUITO;172205820;1513238;RUFFLES PAPAS LIMON TWIST 136G;31/3/2026;21;1,00
IÑAQUITO;36990;1513238;MAGGI MOSTAZA DOY PACK 500 GR.;31/3/2026;24;1,00
IÑAQUITO;175554275;1513238;SAPOLIO AMBIENTADOR AROMA ANTITABACO 360 ML;31/3/2026;12;1,00
IÑAQUITO;33130;1513238;SAN CARLOS AZUCAR BLANCA 5 KG.;31/3/2026;6;1,00
IÑAQUITO;135153047;1513238;TRU LECHE SEMIDESCREMADA 1LT;31/3/2026;24;2,00
IÑAQUITO;97664;1513238;BIANCHI CARAMELO CHOCOLATE BLANCO 400 GR.;31/3/2026;18;1,00
IÑAQUITO;32612;1513238;VAN CAMPS ATUN EN ACEITE ABRE FACIL 184 GR.;31/3/2026;96;2,00
IÑAQUITO;117001795;1513238;HUGGIES TOALLAS HUMEDAS MEGA PROMO 3 X 96UND C/U;31/3/2026;6;1,00
IÑAQUITO;129651200;1513238;NIVEA DEO SPRAY SATIN 150ML 2DO 50% DTO.;31/3/2026;6;1,00
IÑAQUITO;97679;1513238;CONDIMENSA LAUREL HOJA FUNDA 15 GR.;31/3/2026;25;1,00
IÑAQUITO;27227;1513238;SABORA AJO FUNDA 50 GR.;31/3/2026;12;0,08
IÑAQUITO;154103011;1513238;OLÉ TOTOPOS TORTILLA DE MAÍZ NATURAL 300g;31/3/2026;12;1,00
IÑAQUITO;27286;1513238;AJI-NO-MOTO SAZONADOR FUNDA 100 GR.;31/3/2026;15;0,08
IÑAQUITO;183705011;1513238;SAHARA SHAMPOO SIN SAL CEBOLLA 1L;31/3/2026;12;1,00
IÑAQUITO;84242;1513238;TIPS AMBIENTAL PASTILLA CAMPOS DE JAZMIN 95 GR.;31/3/2026;24;1,00
IÑAQUITO;201454922;1513238;LA VAQUITA LECHE ENTERA UHT FOURPACK 1LT;31/3/2026;2;1,00
IÑAQUITO;78050;1513238;LISTERINE ENJUAGUE BUCAL ZERO 500 ML.;31/3/2026;12;1,00
IÑAQUITO;137752941;1513238;ELITE PAPEL HIGIENICO MANZANILLA 35M X4/12;31/3/2026;12;1,00
IÑAQUITO;133901232;1513238;GOLDERY REPUESTO DE  FILM 100 METROS;31/3/2026;24;1,00
IÑAQUITO;158952941;1513238;NIVEA CREMA CORPORAL MILK NUTRITIVA 400 ML;31/3/2026;9;0,75
IÑAQUITO;141852952;1513238;PARA MI BEBÉ JABON LIQUIDO GLICERINA 500 ML;31/3/2026;12;1,00
IÑAQUITO;28990;1513238;KALIPTO DESINFECTANTE FRESCURA MARINA 2 LT.;31/3/2026;6;1,00
IÑAQUITO;189455067;1513238;TONI LECHE SEMIDESCREMADA TETRAPACK 1000 ML;31/3/2026;12;1,00
IÑAQUITO;108600198;1513238;LA BRUJITA ESCOBA NEON UN;31/3/2026;12;1,00
IÑAQUITO;49807;1513238;ALESOL ACEITE CON ACHIOTE 200 ML.;31/3/2026;30;1,00
IÑAQUITO;29087;1513238;LAVA CREMA LAVAVAJILLA FLORAL MANZANA 450 GR.;31/3/2026;18;1,00
IÑAQUITO;85554;1513238;LAVA BARRA LAVAVAJILLA ARRANCA GRASA 200 GR.;31/3/2026;48;1,00
IÑAQUITO;44331;1513238;MR.MUSCULO ANTIGRASA ACCION NARANJA PISTOLA 500 ML.;31/3/2026;12;1,00
IÑAQUITO;28268;1513238;PULVAPIES DESODORANTE SPRAY PREVENTIVO 200 ML.;31/3/2026;24;1,00
IÑAQUITO;140053024;1513238;ELITE PAPEL HIGIENICO SOFT&STRONG XG 26M X18/4;31/3/2026;8;2,00
IÑAQUITO;31875;1513238;K-CHITOS FIESTA 170 GR;31/3/2026;12;1,00
IÑAQUITO;170102974;1513238;LUSTRE ESPONJA MAGICA X 2;31/3/2026;20;1,00
IÑAQUITO;198504959;1513238;EL SABOR CURCUMA EN POLVO 50GR;31/3/2026;24;1,00
IÑAQUITO;154603226;1513238;VANISH ROSA PACK 900ML+130ML;31/3/2026;6;1,00
IÑAQUITO;193604900;1513238;OREO GALLETA SABOR A VAINILLA ROLLO 135 GR;31/3/2026;30;1,00
IÑAQUITO;123002751;1513238;CICLON DETERGENTE EN POLVO XPOWER FLORAL FUNDA 350GR;31/3/2026;30;1,00
IÑAQUITO;33356;1513238;TIPS PASTILLA BAÑO ANTIBACTERIAL FRUTILLA 90 GR.;31/3/2026;24;1,00
IÑAQUITO;132101567;1513238;AXE PACK DESODORANTE BS ICE CHILL 150ML;31/3/2026;6;1,00
IÑAQUITO;132501501;1513238;NUTRIBELA 10 BIOKERATINA SACHET 70 ML;31/3/2026;14;0,17
IÑAQUITO;58350;1513238;SANTA MARIA AZUCAR BLANCA 5 KG.;31/3/2026;24;4,00
IÑAQUITO;200905066;1513238;FAMILIA SERVILLETA GREEN DÍA A DÍA FIBRA RECICLADA  EXTRA PACK X 200 UN;31/3/2026;20;1,00
IÑAQUITO;33375;1513238;TIPS DESINFECTANTE FRUTILLA 1 LT.;31/3/2026;12;1,00
IÑAQUITO;204655738;1513238;CURITAS TRANSPIEL 20 UNIDADES;31/3/2026;12;1,00
IÑAQUITO;67498;1513238;MASTER GUANTE BI-COLOR DOMESTICO C-22 #7 1/2;31/3/2026;12;1,00
IÑAQUITO;27575;1513238;VAN CAMPS ATUN EN ACEITE 184 GR.;31/3/2026;48;1,00
IÑAQUITO;84571;1513238;SAN CARLOS AZUCAR BLANCA 100 STICKS 500 GR;31/3/2026;24;1,00
IÑAQUITO;132101250;1513238;DON VITTORIO SPAGUETTI 950 GR;31/3/2026;12;1,00
IÑAQUITO;192855011;1513238;KIYÚ ACONDICIONADOR CON KERATINA COCO ALOE DOYPACK 650ML;31/3/2026;12;1,00
IÑAQUITO;122951234;1513238;NOVA TOALLA CLASICA LLEVE3 PAGUE 2;31/3/2026;8;1,00
IÑAQUITO;60327;1513238;POMPI FRESH 4PACK X160;31/3/2026;8;1,00
IÑAQUITO;169003629;1513238;KINOE CREMA PARA PEINAR ELIXIR 4 OLEOS RIZOS 275ML;31/3/2026;12;1,00
IÑAQUITO;207504898;1513238;NUTRIBELA PACK SHAMPOO BIOCOLAGENO 400ML+ACONDICIONADOR 370ML+TRATAMIENTO 300ML;31/3/2026;6;1,00
IÑAQUITO;28932;1513238;FAST CLORO GALON 3.8 LT.;31/3/2026;6;1,00
IÑAQUITO;199805374;1513238;CONDIMENSA MIEL DE ABEJA FRASCO 230 GR;31/3/2026;16;1,00
IÑAQUITO;46344;1513238;CARICIA BROCHETAS FESTIVAL 10CM X 100 UN.;31/3/2026;25;1,00
IÑAQUITO;132901880;1513238;PRODICEREAL MANI MOLIDO DOYPACK 250 GR;31/3/2026;25;1,00
IÑAQUITO;186605349;1513238;DANNY SERVILLETAS CLÁSICA X 300UN.;31/3/2026;60;3,00
IÑAQUITO;201854993;1513238;CRUZEIRO CAFÉ  LIOFILIZADO  DOYPACK 50 GR;31/3/2026;24;1,00
IÑAQUITO;170903093;1513238;TRU LECHE EVAPORADA 500ML;31/3/2026;6;1,00
IÑAQUITO;31331;1513238;FESTIVAL PINCHOS REDONDOS DE 30CM X 100 UN.;31/3/2026;25;1,00
IÑAQUITO;49325;1513238;VITA LECHE UHT DESLACTOSADA  1 LT.;31/3/2026;12;1,00
IÑAQUITO;28830;1513238;LUSTRE ESPONJA DE ACERO X 6 UN.;31/3/2026;20;1,00
IÑAQUITO;144603193;1513238;LAVA CREMA LAVAVAJILLA MANZANA 235 GR.;31/3/2026;36;1,00
IÑAQUITO;104354;1513238;CONDIMENSA PIMIENTA DE OLOR 25GR;31/3/2026;25;1,00
IÑAQUITO;40237;1513238;DON VITTORIO FIDEO CABELLO DE ANGEL 400 GR.;31/3/2026;24;1,00
IÑAQUITO;97717;1513238;CONDIMENSA CLAVO DE OLOR 50 GR.;31/3/2026;25;1,00
IÑAQUITO;168152964;1513238;LAVA CREMA LAVAVAJILLA UVA 900 G;31/3/2026;24;2,00
IÑAQUITO;72096;1513238;AXION LAVAVAJILLA CREMA AVENA 450 GR;31/3/2026;24;1,00
IÑAQUITO;108600112;1513238;FACUNDO TRIPACK MAIZ DULCE C/U 227 GR;31/3/2026;8;1,00
IÑAQUITO;117601029;1513238;GRANUTS MEZCLA MANI MAIZ ALMENDRAS Y ARANDANOS DE 40 GR.;31/3/2026;48;1,00
IÑAQUITO;28921;1513238;TIPS AMBIENTAL PASTILLA FRUTILLA 95 GR.;31/3/2026;24;1,00
IÑAQUITO;188354900;1513238;ISABEL ATUN EN ACEITE DE GIRASOL ABRE FACIL 142 GR;31/3/2026;48;1,00
IÑAQUITO;135502964;1513238;COCOLON ARROZ MACARENO 4LB;31/3/2026;20;1,00
IÑAQUITO;205355024;1513238;HADA PAPEL HIGENICO JUMBO 1U 200M;31/3/2026;4;1,00
IÑAQUITO;79006;1513238;MR.MUSCULO LIMPIADOR LIQUIDO BAÑO REPUESTO 500 ML.;31/3/2026;12;1,00
IÑAQUITO;27948;1513238;SNOB MERMELADA GUAYABA 290 GR.;31/3/2026;12;1,00
IÑAQUITO;133751369;1513238;BANQUETE ARROZ ENVEJECIDO 5 KG.;31/3/2026;8;1,00
IÑAQUITO;72087;1513238;MACHICA QUINTAL 45.36 KG;31/3/2026;1;1,00
IÑAQUITO;125001226;1513238;VITA SIXPACK LECHE UHT ENTERA 1 LT;31/3/2026;2;1,00
IÑAQUITO;36385;1513238;LAVA CREMA LAVAVAJILLA X 5 KG.;31/3/2026;4;1,00
IÑAQUITO;33103;1513238;JOHNSON´S BABY SHAMPOO ORIGINAL 400 ML.;31/3/2026;12;1,00
IÑAQUITO;76929;1513238;DELVERANO CIRUELA SIN SEMILLA 200 GR.;31/3/2026;24;1,00
IÑAQUITO;44175;1513238;LIFE ENDULZANTE NATURAL X 100 UN.;31/3/2026;24;2,00
IÑAQUITO;162553003;1513238;LAVATODO LAVAVAJILLA LIMÓN 550ML;31/3/2026;12;1,00
IÑAQUITO;75883;1513238;TIPS LIMPIA VIDRIOS AMONIAC PISTOLA 500 ML.;31/3/2026;12;1,00
IÑAQUITO;118000735;1513238;ESTRELLA FIBRA PARA CORTAR UN;31/3/2026;50;1,00
IÑAQUITO;208955156;1513238;CONDIMENSA COMINO MOLIDO 50 GR;31/3/2026;16;1,00
IÑAQUITO;28140;1513238;MATERNITY TOALLA SANITARIA MAXI X 10 UN.;31/3/2026;32;1,00
IÑAQUITO;183455015;1513238;RICOMPLETO CALDO DE GALLINA CRIOLLA 8 SOBRES 72 GR;31/3/2026;24;1,00
IÑAQUITO;96603;1513238;ESTRELLA ESPONJA MIXTA COMBY;31/3/2026;10;1,00
IÑAQUITO;28963;1513238;POLWAX CERA DE PISOS ROJA 4 LT.;31/3/2026;8;2,00
IÑAQUITO;43629;1513238;MAX PRELAVADO CUELLOS Y PUÑOS REPUESTO;31/3/2026;12;1,00
IÑAQUITO;209855202;1513238;CHOCOLISTO CHOCOLATE FUNDA 380 GR.;31/3/2026;12;1,00
IÑAQUITO;29015;1513238;SAPOLIO INSECTICIDA AEROSOL MATA MOSCAS/ZANCUDO;31/3/2026;12;1,00
IÑAQUITO;163453805;1513238;ESTRELLA GUANTE DOMESTICO AMARILLO TALLA 7 1/2 UN;31/3/2026;12;1,00
IÑAQUITO;27743;1513238;REGIA MARGARINA 1 KG.;31/3/2026;12;1,00
IÑAQUITO;138103096;1513238;ELITE PAPEL HIGIENICO SOFT&STRONG XG 26M X4/10;31/3/2026;10;1,00
IÑAQUITO;120850739;1513238;CONDIMENSA VINAGRE DE MANZANA 450 ML;31/3/2026;15;1,00
IÑAQUITO;29428;1513238;JOICE RINSE HIERBAS 4 LT.;31/3/2026;6;1,00
IÑAQUITO;97618;1513238;KALIPTO DESINFECTANTE DOY PACK EUCALIPTO 500 ML.;31/3/2026;36;2,00
IÑAQUITO;135802975;1513238;SANTA MARIA ARROZ MACAREÑO 10 KG.;31/3/2026;6;6,00
IÑAQUITO;142803781;1513238;SANTA MARIA ALIMENTO PARA PERROS 15KG;31/3/2026;1;1,00
IÑAQUITO;152053769;1513238;PACK X 4 ESTRELLA ESPONJA MIXTA 4X3;31/3/2026;24;1,00
IÑAQUITO;208955181;1513238;CONDIMENSA SAZONADOR FINAS HIERBAS 50 GR;31/3/2026;16;1,00
IÑAQUITO;183106801;1513238;MASTER GUANTE  DOMESTICO CORRUGADO TALLA 7.5 UN.;31/3/2026;12;1,00
IÑAQUITO;98970;1513238;NOSOTRAS TAMPON DIGITAL REGULAR X 10 UN.;31/3/2026;12;1,00
IÑAQUITO;143653084;1513238;ZAGAZ LAVAPLATOS CITRUS POWER 425GR.;31/3/2026;16;1,00
IÑAQUITO;27393;1513238;HORNIMANS TE X 100 FUNDAS UN.;31/3/2026;8;1,00
IÑAQUITO;182105081;1513238;EL SABOR VINAGRE 250 ML;31/3/2026;12;1,00
IÑAQUITO;145802987;1513238;PANOLINI TOALLITAS ALOE FLOWPACK PAGUE 240 LLEVE 300;31/3/2026;12;2,00
IÑAQUITO;206555010;1513238;SAVITAL PACK SHAMPOO ELIXIR 510ML+ACONDICIONADOR ELIXIR 490ML;31/3/2026;6;1,00
IÑAQUITO;172555045;1513238;SANTA MARIA ACEITE GIRASOL 1LT;31/3/2026;15;1,00
IÑAQUITO;112750105;1513238;VENUS RASURADORA DESECHABLE MUJER SIMPLY UN;31/3/2026;16;0,20
IÑAQUITO;77295;1513238;CLOROX CLORO REGULAR 1 LT.;31/3/2026;12;1,00
IÑAQUITO;31406;1513238;"NARIBEH FUNDA DE BASURA GRANDE ""23X28"" X 10 UN.";31/3/2026;100;1,00
IÑAQUITO;97760;1513238;RUFFLES PAPA NATURAL ALMOHADA 300 GR 25 GR C/U;31/3/2026;7;1,00
